{
  "schemaVersion": 1,
  "generatedAt": "2026-09-21T03:16:36.237Z",
  "sourceCommit": "56c6faaccf858b4f4b7ccfb7f6df602d50c36c5f",
  "acceptanceRun": {
    "runId": "run-20260921-56c6faa-01",
    "path": "reports/acceptance-runs/run-20260921-56c6faa-01.json",
    "sha256": "7f0a83ebc9f35973e5dda161dfb755f5f11c2d5d4850735102f6eaa1121d75c0",
    "sizeBytes": 78551,
    "repositoryDirty": false
  },
  "candidate": {
    "inventoryPath": "reports/release/candidate-artifact.json",
    "inventorySha256": "83ba54aca6b152ed2d710499631d9d21ed0404adb6e01938ce2e5a01f95fe805",
    "inventorySizeBytes": 563,
    "expectedPath": "apps/desktop/release/YuwenDesk-Setup-0.1.0-x64.exe",
    "artifactPresent": true,
    "artifactClass": "UNSIGNED_TEST_BUILD",
    "sha256": "2c2bcb4263cef88322d9691d7755fe34dc9e0e13e416b3d4e36f9ded7f61dbe0",
    "sizeBytes": 131049412
  },
  "statuses": {
    "softwareStatus": "BLOCKED",
    "resourceCoverageStatus": "BLOCKED",
    "teachingValidationStatus": "NOT_REVIEWED",
    "artifactClass": "UNSIGNED_TEST_BUILD",
    "releaseDisposition": "BLOCKED",
    "reasonCode": "RELEASE_WINDOWS_EVIDENCE_REQUIRED"
  },
  "gates": {
    "sourceTreeClean": true,
    "cleanWindowsPassed": false,
    "artifactSigned": false,
    "distributionAuthorized": false,
    "controlledTrialAuthorized": false,
    "dataBoundaryApproved": true,
    "costBoundaryApproved": true,
    "defectAuditStatus": "NOT_RUN"
  },
  "caseSummary": {
    "PASS": 6,
    "FAIL": 0,
    "BLOCKED": 38,
    "NOT_RUN": 126
  },
  "cases": [
    {
      "caseId": "AI-001",
      "severity": "P1",
      "status": "BLOCKED",
      "blockerCode": "BLOCKED_EXTERNAL_LIVE_API_AND_BUDGET",
      "externalInputIds": [
        "EXT03",
        "EXT04",
        "EXT10"
      ]
    },
    {
      "caseId": "AI-002",
      "severity": "P1",
      "status": "NOT_RUN",
      "blockerCode": null,
      "externalInputIds": []
    },
    {
      "caseId": "AI-003",
      "severity": "P1",
      "status": "NOT_RUN",
      "blockerCode": null,
      "externalInputIds": []
    },
    {
      "caseId": "AI-004",
      "severity": "P1",
      "status": "NOT_RUN",
      "blockerCode": null,
      "externalInputIds": []
    },
    {
      "caseId": "AI-005",
      "severity": "P1",
      "status": "NOT_RUN",
      "blockerCode": null,
      "externalInputIds": []
    },
    {
      "caseId": "AI-006",
      "severity": "P0",
      "status": "NOT_RUN",
      "blockerCode": null,
      "externalInputIds": []
    },
    {
      "caseId": "AI-007",
      "severity": "P1",
      "status": "NOT_RUN",
      "blockerCode": null,
      "externalInputIds": []
    },
    {
      "caseId": "AI-008",
      "severity": "P1",
      "status": "NOT_RUN",
      "blockerCode": null,
      "externalInputIds": []
    },
    {
      "caseId": "AI-009",
      "severity": "P1",
      "status": "NOT_RUN",
      "blockerCode": null,
      "externalInputIds": []
    },
    {
      "caseId": "AI-010",
      "severity": "P0",
      "status": "BLOCKED",
      "blockerCode": "BLOCKED_EXTERNAL_PRIVACY_AUTHORIZATION",
      "externalInputIds": [
        "EXT10"
      ]
    },
    {
      "caseId": "BIZ-R001",
      "severity": "P1",
      "status": "NOT_RUN",
      "blockerCode": null,
      "externalInputIds": []
    },
    {
      "caseId": "BIZ-R002",
      "severity": "P1",
      "status": "NOT_RUN",
      "blockerCode": null,
      "externalInputIds": []
    },
    {
      "caseId": "BIZ-R003",
      "severity": "P1",
      "status": "NOT_RUN",
      "blockerCode": null,
      "externalInputIds": []
    },
    {
      "caseId": "BIZ-R004",
      "severity": "P1",
      "status": "NOT_RUN",
      "blockerCode": null,
      "externalInputIds": []
    },
    {
      "caseId": "BIZ-R005",
      "severity": "P1",
      "status": "NOT_RUN",
      "blockerCode": null,
      "externalInputIds": []
    },
    {
      "caseId": "BIZ-R006",
      "severity": "P1",
      "status": "NOT_RUN",
      "blockerCode": null,
      "externalInputIds": []
    },
    {
      "caseId": "BIZ-R007",
      "severity": "P1",
      "status": "NOT_RUN",
      "blockerCode": null,
      "externalInputIds": []
    },
    {
      "caseId": "BIZ-R008",
      "severity": "P1",
      "status": "NOT_RUN",
      "blockerCode": null,
      "externalInputIds": []
    },
    {
      "caseId": "BIZ-R009",
      "severity": "P1",
      "status": "NOT_RUN",
      "blockerCode": null,
      "externalInputIds": []
    },
    {
      "caseId": "BIZ-R010",
      "severity": "P1",
      "status": "NOT_RUN",
      "blockerCode": null,
      "externalInputIds": []
    },
    {
      "caseId": "BIZ-R011",
      "severity": "P1",
      "status": "NOT_RUN",
      "blockerCode": null,
      "externalInputIds": []
    },
    {
      "caseId": "BIZ-R012",
      "severity": "P1",
      "status": "NOT_RUN",
      "blockerCode": null,
      "externalInputIds": []
    },
    {
      "caseId": "BIZ-R013",
      "severity": "P1",
      "status": "NOT_RUN",
      "blockerCode": null,
      "externalInputIds": []
    },
    {
      "caseId": "BIZ-R014",
      "severity": "P1",
      "status": "NOT_RUN",
      "blockerCode": null,
      "externalInputIds": []
    },
    {
      "caseId": "BIZ-R015",
      "severity": "P1",
      "status": "NOT_RUN",
      "blockerCode": null,
      "externalInputIds": []
    },
    {
      "caseId": "BIZ-R016",
      "severity": "P1",
      "status": "NOT_RUN",
      "blockerCode": null,
      "externalInputIds": []
    },
    {
      "caseId": "BIZ-R017",
      "severity": "P1",
      "status": "NOT_RUN",
      "blockerCode": null,
      "externalInputIds": []
    },
    {
      "caseId": "BIZ-R018",
      "severity": "P1",
      "status": "NOT_RUN",
      "blockerCode": null,
      "externalInputIds": []
    },
    {
      "caseId": "BIZ-R019",
      "severity": "P1",
      "status": "NOT_RUN",
      "blockerCode": null,
      "externalInputIds": []
    },
    {
      "caseId": "BIZ-R020",
      "severity": "P1",
      "status": "NOT_RUN",
      "blockerCode": null,
      "externalInputIds": []
    },
    {
      "caseId": "BIZ-R021",
      "severity": "P1",
      "status": "NOT_RUN",
      "blockerCode": null,
      "externalInputIds": []
    },
    {
      "caseId": "BIZ-R022",
      "severity": "P1",
      "status": "NOT_RUN",
      "blockerCode": null,
      "externalInputIds": []
    },
    {
      "caseId": "BIZ-R023",
      "severity": "P1",
      "status": "NOT_RUN",
      "blockerCode": null,
      "externalInputIds": []
    },
    {
      "caseId": "BIZ-R024",
      "severity": "P1",
      "status": "NOT_RUN",
      "blockerCode": null,
      "externalInputIds": []
    },
    {
      "caseId": "BIZ-R025",
      "severity": "P1",
      "status": "NOT_RUN",
      "blockerCode": null,
      "externalInputIds": []
    },
    {
      "caseId": "BIZ-R026",
      "severity": "P1",
      "status": "NOT_RUN",
      "blockerCode": null,
      "externalInputIds": []
    },
    {
      "caseId": "BIZ-R027",
      "severity": "P1",
      "status": "NOT_RUN",
      "blockerCode": null,
      "externalInputIds": []
    },
    {
      "caseId": "BIZ-R028",
      "severity": "P1",
      "status": "NOT_RUN",
      "blockerCode": null,
      "externalInputIds": []
    },
    {
      "caseId": "BIZ-R029",
      "severity": "P1",
      "status": "NOT_RUN",
      "blockerCode": null,
      "externalInputIds": []
    },
    {
      "caseId": "BIZ-R030",
      "severity": "P1",
      "status": "NOT_RUN",
      "blockerCode": null,
      "externalInputIds": []
    },
    {
      "caseId": "BIZ-R031",
      "severity": "P1",
      "status": "NOT_RUN",
      "blockerCode": null,
      "externalInputIds": []
    },
    {
      "caseId": "BIZ-R032",
      "severity": "P1",
      "status": "NOT_RUN",
      "blockerCode": null,
      "externalInputIds": []
    },
    {
      "caseId": "BIZ-R033",
      "severity": "P1",
      "status": "NOT_RUN",
      "blockerCode": null,
      "externalInputIds": []
    },
    {
      "caseId": "BIZ-R034",
      "severity": "P1",
      "status": "NOT_RUN",
      "blockerCode": null,
      "externalInputIds": []
    },
    {
      "caseId": "BIZ-R035",
      "severity": "P1",
      "status": "NOT_RUN",
      "blockerCode": null,
      "externalInputIds": []
    },
    {
      "caseId": "BIZ-R036",
      "severity": "P1",
      "status": "NOT_RUN",
      "blockerCode": null,
      "externalInputIds": []
    },
    {
      "caseId": "BIZ-R037",
      "severity": "P1",
      "status": "NOT_RUN",
      "blockerCode": null,
      "externalInputIds": []
    },
    {
      "caseId": "BIZ-R038",
      "severity": "P1",
      "status": "NOT_RUN",
      "blockerCode": null,
      "externalInputIds": []
    },
    {
      "caseId": "BIZ-R039",
      "severity": "P1",
      "status": "NOT_RUN",
      "blockerCode": null,
      "externalInputIds": []
    },
    {
      "caseId": "BIZ-R040",
      "severity": "P1",
      "status": "NOT_RUN",
      "blockerCode": null,
      "externalInputIds": []
    },
    {
      "caseId": "BIZ-R041",
      "severity": "P1",
      "status": "NOT_RUN",
      "blockerCode": null,
      "externalInputIds": []
    },
    {
      "caseId": "BIZ-R042",
      "severity": "P1",
      "status": "NOT_RUN",
      "blockerCode": null,
      "externalInputIds": []
    },
    {
      "caseId": "BIZ-R043",
      "severity": "P1",
      "status": "NOT_RUN",
      "blockerCode": null,
      "externalInputIds": []
    },
    {
      "caseId": "BIZ-R044",
      "severity": "P1",
      "status": "NOT_RUN",
      "blockerCode": null,
      "externalInputIds": []
    },
    {
      "caseId": "BIZ-R045",
      "severity": "P1",
      "status": "NOT_RUN",
      "blockerCode": null,
      "externalInputIds": []
    },
    {
      "caseId": "BIZ-R046",
      "severity": "P1",
      "status": "NOT_RUN",
      "blockerCode": null,
      "externalInputIds": []
    },
    {
      "caseId": "BIZ-R047",